{
  "schema": "trex-action-plan/0.1",
  "artifact_status": "synthetic_design_example",
  "execution_authorized": false,
  "plan_id": "example.research-to-paper",
  "revision": 1,
  "goal": "Compare, review, propose a bounded paper experiment, observe and propose a next version.",
  "state": "proposed",
  "source_repository_head": "c4035f6b30f5a177c0a9b4334b682589c9d62377",
  "artifacts": [
    {
      "id": "fixture.snapshot",
      "kind": "DataSnapshot",
      "sha256": "a6d0933e3cb6fb65cea2f091985143a4cbb251b2ee14cf3457990aefb674c9e5",
      "classification": "synthetic_fixture",
      "payload": {
        "fixture": true,
        "contains_market_observations": false,
        "purpose": "Contract fixture only; a real loader must resolve an authorized immutable data snapshot."
      }
    },
    {
      "id": "fixture.baseline",
      "kind": "StrategyVersion",
      "sha256": "a57cd61aa48de0cb3ac9c1b059832bd648b8b39808b48a288147be9b99250c13",
      "classification": "synthetic_fixture",
      "payload": {
        "fixture": true,
        "strategy_name": "baseline-example",
        "revision": 1
      }
    },
    {
      "id": "fixture.challenger",
      "kind": "StrategyVersion",
      "sha256": "ceeb86f42b4e68ddca84ff48613e33c1f484be27b56f35e07691160312e09f59",
      "classification": "synthetic_fixture",
      "payload": {
        "fixture": true,
        "strategy_name": "cost-aware-variant-example",
        "revision": 1
      }
    },
    {
      "id": "fixture.protocol",
      "kind": "ExperimentSpec",
      "sha256": "efce0c2d4e2fc61ecb3f28e237b68aadc34b1692cd595972bd179f64eb2626e5",
      "classification": "synthetic_fixture",
      "payload": {
        "fixture": true,
        "scope": "exploratory",
        "evaluation_window": "not_assigned",
        "limits": "operator_to_define",
        "no_live_money": true
      }
    },
    {
      "id": "fixture.policy",
      "kind": "GovernancePolicy",
      "sha256": "d973e0d554128590e92721e16552cbeccc6c082e7aa515c81e94b87b39dd6af2",
      "classification": "synthetic_fixture",
      "payload": {
        "fixture": true,
        "grants": [],
        "default": "deny_effects_without_verified_mandate",
        "promotion": "proposal_only"
      }
    }
  ],
  "nodes": [
    {
      "id": "N01",
      "label": "Resolve pinned research inputs",
      "operation": "research.resolve_inputs",
      "operation_version": "0.1",
      "owner_role": "data_service",
      "effect_class": "read",
      "target_environment": "research",
      "dependencies": [],
      "inputs": {
        "source": {
          "artifact_id": "fixture.snapshot",
          "expected_type": "DataSnapshot"
        }
      },
      "outputs": {
        "snapshot": "DataSnapshot"
      },
      "required_guards": [
        "authorized_data_scope",
        "input_hash_match"
      ],
      "retry": {
        "mode": "bounded_idempotent",
        "max_attempts": 3
      },
      "timeout_seconds": 300,
      "on_failure": "block_descendants",
      "required_receipts": [
        "input_manifest",
        "operation_outcome"
      ],
      "postcondition": "receipt_published"
    },
    {
      "id": "N02",
      "label": "Check data capability and timing",
      "operation": "research.check_coverage",
      "operation_version": "0.1",
      "owner_role": "data_service",
      "effect_class": "research_write",
      "target_environment": "research",
      "dependencies": [
        {
          "node_id": "N01",
          "on_outcomes": [
            "completed"
          ]
        }
      ],
      "inputs": {
        "snapshot": {
          "producer_node_id": "N01",
          "output_name": "snapshot",
          "expected_type": "DataSnapshot"
        }
      },
      "outputs": {
        "coverage": "CoverageReceipt"
      },
      "required_guards": [
        "point_in_time_valid"
      ],
      "retry": {
        "mode": "bounded_idempotent",
        "max_attempts": 3
      },
      "timeout_seconds": 300,
      "on_failure": "block_descendants",
      "required_receipts": [
        "input_manifest",
        "operation_outcome"
      ],
      "postcondition": "receipt_published"
    },
    {
      "id": "N03",
      "label": "Replay frozen baseline",
      "operation": "research.run_baseline",
      "operation_version": "0.1",
      "owner_role": "research_worker",
      "effect_class": "research_write",
      "target_environment": "research",
      "dependencies": [
        {
          "node_id": "N02",
          "on_outcomes": [
            "passed"
          ]
        }
      ],
      "inputs": {
        "snapshot": {
          "producer_node_id": "N01",
          "output_name": "snapshot",
          "expected_type": "DataSnapshot"
        },
        "strategy": {
          "artifact_id": "fixture.baseline",
          "expected_type": "StrategyVersion"
        },
        "protocol": {
          "artifact_id": "fixture.protocol",
          "expected_type": "ExperimentSpec"
        }
      },
      "outputs": {
        "result": "ResearchResult"
      },
      "required_guards": [
        "research_budget_available"
      ],
      "retry": {
        "mode": "bounded_idempotent",
        "max_attempts": 3
      },
      "timeout_seconds": 300,
      "on_failure": "block_descendants",
      "required_receipts": [
        "input_manifest",
        "operation_outcome"
      ],
      "postcondition": "receipt_published"
    },
    {
      "id": "N04",
      "label": "Replay challenger on the same inputs",
      "operation": "research.run_challenger",
      "operation_version": "0.1",
      "owner_role": "research_worker",
      "effect_class": "research_write",
      "target_environment": "research",
      "dependencies": [
        {
          "node_id": "N02",
          "on_outcomes": [
            "passed"
          ]
        }
      ],
      "inputs": {
        "snapshot": {
          "producer_node_id": "N01",
          "output_name": "snapshot",
          "expected_type": "DataSnapshot"
        },
        "strategy": {
          "artifact_id": "fixture.challenger",
          "expected_type": "StrategyVersion"
        },
        "protocol": {
          "artifact_id": "fixture.protocol",
          "expected_type": "ExperimentSpec"
        }
      },
      "outputs": {
        "result": "ResearchResult"
      },
      "required_guards": [
        "research_budget_available"
      ],
      "retry": {
        "mode": "bounded_idempotent",
        "max_attempts": 3
      },
      "timeout_seconds": 300,
      "on_failure": "block_descendants",
      "required_receipts": [
        "input_manifest",
        "operation_outcome"
      ],
      "postcondition": "receipt_published"
    },
    {
      "id": "N05",
      "label": "Build paired comparison",
      "operation": "research.compare",
      "operation_version": "0.1",
      "owner_role": "research_worker",
      "effect_class": "research_write",
      "target_environment": "research",
      "dependencies": [
        {
          "node_id": "N03",
          "on_outcomes": [
            "completed"
          ]
        },
        {
          "node_id": "N04",
          "on_outcomes": [
            "completed"
          ]
        }
      ],
      "inputs": {
        "baseline": {
          "producer_node_id": "N03",
          "output_name": "result",
          "expected_type": "ResearchResult"
        },
        "challenger": {
          "producer_node_id": "N04",
          "output_name": "result",
          "expected_type": "ResearchResult"
        }
      },
      "outputs": {
        "comparison": "ComparisonResult"
      },
      "required_guards": [
        "same_comparison_basis"
      ],
      "retry": {
        "mode": "bounded_idempotent",
        "max_attempts": 3
      },
      "timeout_seconds": 300,
      "on_failure": "block_descendants",
      "required_receipts": [
        "input_manifest",
        "operation_outcome"
      ],
      "postcondition": "receipt_published"
    },
    {
      "id": "N06",
      "label": "Publish comparison plot specification",
      "operation": "workspace.project_comparison",
      "operation_version": "0.1",
      "owner_role": "projector",
      "effect_class": "research_write",
      "target_environment": "research",
      "dependencies": [
        {
          "node_id": "N05",
          "on_outcomes": [
            "completed"
          ]
        }
      ],
      "inputs": {
        "result": {
          "producer_node_id": "N05",
          "output_name": "comparison",
          "expected_type": "ComparisonResult"
        }
      },
      "outputs": {
        "chart": "ChartSpec"
      },
      "required_guards": [
        "result_hash_match"
      ],
      "retry": {
        "mode": "bounded_idempotent",
        "max_attempts": 3
      },
      "timeout_seconds": 300,
      "on_failure": "block_descendants",
      "required_receipts": [
        "input_manifest",
        "operation_outcome"
      ],
      "postcondition": "receipt_published"
    },
    {
      "id": "N07",
      "label": "Run deterministic broker-fault acceptance",
      "operation": "validation.run_fault_suite",
      "operation_version": "0.1",
      "owner_role": "test_worker",
      "effect_class": "research_write",
      "target_environment": "research",
      "dependencies": [
        {
          "node_id": "N02",
          "on_outcomes": [
            "passed"
          ]
        }
      ],
      "inputs": {
        "protocol": {
          "artifact_id": "fixture.protocol",
          "expected_type": "ExperimentSpec"
        }
      },
      "outputs": {
        "tests": "TestReceipt"
      },
      "required_guards": [
        "no_external_broker_access"
      ],
      "retry": {
        "mode": "bounded_idempotent",
        "max_attempts": 3
      },
      "timeout_seconds": 300,
      "on_failure": "block_descendants",
      "required_receipts": [
        "input_manifest",
        "operation_outcome"
      ],